image,objectname,description,boardgamecategories,yearpublished,average,baverage,objectid,minplayers,maxplayers,minplaytime,maxplaytime,bggrecagerange
http://cf.geekdo-images.com/images/pic3043734.jpg,King of Tokyo,"In King of Tokyo, you play mutant monsters, gigantic robots, and strange aliens—all of whom are destroying Tokyo and whacking each other in order to become the one and only King of Tokyo.

At the start of each turn, you roll six dice, which show the following six symbols: 1, 2, or 3 Victory Points, Energy, Heal, and Attack. Over three successive throws, choose whether to keep or discard each die in order to win victory points, gain energy, restore health, or attack other players into understanding that Tokyo is YOUR territory.

The fiercest player will occupy Tokyo, and earn extra victory points, but that player cant heal and must face all the other monsters alone!

Top this off with special cards purchased with energy that have a permanent or temporary effect, such as the growing of a second head which grants you an additional die, body armor, nova death ray, and more.... and its one of the most explosive games of the year!

In order to win the game, one must either destroy Tokyo by accumulating 20 victory points, or be the only surviving monster once the fighting has ended.","Dice, Fighting, Movies / TV / Radio theme, Science Fiction",2011,7.30891,7.22152,70323,2,6,30,30,6+
http://cf.geekdo-images.com/images/pic1430769.jpg,Legendary: A Marvel Deck Building Game,"Legendary: A Marvel Deck Building Game is set in the Marvel Comics universe. To set up the game, players choose a mastermind villain (Magneto, Loki, Dr. Doom, etc.), stack that particular villains attack cards underneath it, then modify the villain deck as needed based on that villains particular scheme. Players then choose a number of hero decks – Spider-Man, Hulk, Cyclops, Wolverine, etc. – and shuffle them together; since players use only a handful of hero decks out of the fifteen included, the hero deck can vary widely in terms of whats available.

Over the course of the game, players will recruit powerful hero cards to add to their deck in order to build a stronger and more resourceful deck. Players need to build both their recruitment powers (to enlist more heroes) and their fighting ability (to combat the villains who keep popping up to cause trouble). Players recruit heroes from an array of five cards, with empty slots refilled as needed. At the start of a players turn, he reveals a villain and adds it to the row of villains. This row has a limited number of spaces, and if it fills up, the earliest villain to arrive escapes, possibly punishing the heroes in some way. Some villains also take an action when showing up for the first time, such as kidnapping an innocent bystander. The villain deck also contains ""master strike"" cards, and whenever one of these shows up, the mastermind villain (controlled by the game) takes a bonus action.

As players fight and defeat villains, they collect those cards, which will be worth points at games end. Players can also fight the mastermind; if a player has enough fighting power, he claims one of the attack cards beneath the mastermind, which has a particular effect on the game. If all of these cards are claimed, the game ends and players tally their points to see who wins. If the mastermind completes his scheme, however – having a certain number of villains escape, for example, or imposing a certain number of wounds on the heroes – then the players all lose.","Card Game, Comic Book / Strip",2012,7.63815,7.39464,129437,1,5,45,45,10+
http://cf.geekdo-images.com/images/pic1116080.jpg,Lords of Waterdeep,"Waterdeep, the City of Splendors – the most resplendent jewel in the Forgotten Realms, and a den of political intrigue and shady back-alley dealings. In this game, the players are powerful lords vying for control of this great city. Its treasures and resources are ripe for the taking, and that which cannot be gained through trickery and negotiation must be taken by force!

In Lords of Waterdeep, a strategy board game for 2-5 players, you take on the role of one of the masked Lords of Waterdeep, secret rulers of the city. Through your agents, you recruit adventurers to go on quests on your behalf, earning rewards and increasing your influence over the city. Expand the city by purchasing new buildings that open up new actions on the board, and hinder – or help – the other lords by playing Intrigue cards to enact your carefully laid plans.

During the course of play, you may gain points or resources through completing quests, constructing buildings, playing intrigue cards or having other players utilize the buildings you have constructed. At the end of 8 rounds of play, the player who has accrued the most points wins the game.","City Building, Fantasy",2012,7.79639,7.68372,110327,2,5,60,120,10+
http://cf.geekdo-images.com/images/pic2614165.jpg,Monarch,"In Monarch you play as an heir to the throne. Your mother, the Queen, has lived out her years and will soon pass on the crown. The time has come for you and your siblings to demonstrate your intelligence, compassion, bravery, and strength as leaders. Out perform your siblings to demonstrate your ingenuity and strength. Choose strategies that will bring prosperity to the land and glory to your court. Defend the realm from threats and famine. Only the player with the most majestic court will be named heir.

There are many paths to choose from, but only one will become the next monarch. Who will reign?

Monarch is a light strategy game for 2-4 players that lasts 45 minutes. The primary mechanic is set collection; each of the sisters aims to assemble a court of Court Cards in order to prove her worth: wise advisors, exotic animals, and symbolic regalia. Each of these Court Cards provides crowns, and the sister whose court contains the most crowns at the end of the game becomes the Queen.

There are tricks to assembling a majestic court. Some cards dont work together well: the Astronomer is worth nothing if in a court with the Fireworks because he will be unable to see anything! Other cards work very well together: the Beastkeeper is worth more crowns for each animal she shares a court with.",Fantasy,2015,7.00081,5.70976,173115,2,4,30,50,10+
http://cf.geekdo-images.com/images/pic3066125.jpg,Mr. Jack,"In Mr. Jack, one of the two players represents Jack the Ripper, who will be one of the eight characters on the board. This player knows which character is Mr. Jack, and his goal is to flee from the district as soon as possible (or avoid being accused for eight turns). The other player represents an independent investigator (not represented on the board) who tries to guess the identity of Jack — but he can make only one accusation during the game!

During each turn, the players move the characters, using their special powers and placing them either in shadow or light. At the end of each turn, the witnesses declare whether Jack is visible — that is, in light or adjacent to another character — or not (alone in the shadows). This allows the investigator to know which characters are innocent. As the turns progress, the investigator tries to eliminate suspects while Jack tries to escape. Intuition, logic, and cold blood will be necessary for each of the two participants.","Deduction, Murder/Mystery",2006,7.0884,6.95423,21763,2,2,30,30,10+
http://cf.geekdo-images.com/images/pic1519530.jpg,Mr. Jack Pocket,"It has been found again by Bruno Cathala and Ludovic Maublanc with Mr.Jack Pocket, the small card game derived from Mr. Jack. The board is replaced by a square grid made of nine street cards. The suspects, and among them Mr.Jack, are pictured on the cards. Holmes, Watson and a dog are turning around the grid, a system already used by Bruno Cathala in several games, and can ""look"" at the streets in a row or column. Every round, like in Mr.Jack, four actions are available. The first player selects one, his opponent two, and the first player then uses the last remaining action. Actions allow moving a detective one or two spaces clockwise around the grid, turning a card in order to change the view of the streets, swapping two street cards or drawing an alibi card. At the end of the round, Mr.Jack states if he can be seen by one of the detectives. Of course, the detectives must identify Jack, who must stay hidden long enough to escape.","Bluffing, Deduction, Murder/Mystery, Post-Napoleonic",2010,7.01147,6.76206,72287,2,2,15,15,8+
http://cf.geekdo-images.com/images/pic2601683.jpg,Mysterium,"In the 1920s, Mr. MacDowell, a gifted astrologist, immediately detected a supernatural being upon entering his new house in Scotland. He gathered eminent mediums of his time for an extraordinary seance, and they have seven hours to contact the ghost and investigate any clues that it can provide to unlock an old mystery.

Unable to talk, the amnesic ghost communicates with the mediums through visions, which are represented in the game by illustrated cards. The mediums must decipher the images to help the ghost remember how he was murdered: Who did the crime? Where did it take place? Which weapon caused the death? The more the mediums cooperate and guess well, the easier it is to catch the right culprit.

In Mysterium, a reworking of the game system present in Tajemnicze Domostwo, one player takes the role of ghost while everyone else represents a medium. To solve the crime, the ghost must first recall (with the aid of the mediums) all of the suspects present on the night of the murder. A number of suspect, location and murder weapon cards are placed on the table, and the ghost randomly assigns one of each of these in secret to a medium.

Each hour (i.e., game turn), the ghost hands one or more vision cards face up to each medium, refilling their hand to seven each time they share vision cards. These vision cards present dreamlike images to the mediums, with each medium first needing to deduce which suspect corresponds to the vision cards received. Once the ghost has handed cards to the final medium, they start a two-minute sandtimer. Once a medium has placed their token on a suspect, they may also place clairvoyancy tokens on the guesses made by other mediums to show whether they agree or disagree with those guesses.

After time runs out, the ghost reveals to each medium whether the guesses were correct or not. Mediums who guessed correctly move on to guess the location of the crime (and then the murder weapon), while those who didnt keep their vision cards and receive new ones next hour corresponding to the same suspect. Once a medium has correctly guessed the suspect, location and weapon, they move their token to the epilogue board and receive one clairvoyancy point for each hour remaining on the clock. They can still use their remaining clairvoyancy tokens to score additional points.

If one or more mediums fail to identify their proper suspect, location and weapon before the end of the seventh hour, then the ghost has failed and dissipates, leaving the mystery unsolved. If, however, they have all succeeded, then the ghost has recovered enough of its memory to identify the culprit.

Mediums then group their suspect, location and weapon cards on the table and place a number by each group. The ghost then selects one group, places the matching culprit number face down on the epilogue board, picks three vision cards - one for the suspect, one for the location, and one for the weapon - then shuffles these cards. Players who have achieved few clairvoyancy points flip over one vision card at random, then secretly vote on which suspect they think is guilty; players with more points then flip over a second vision card and vote; then those with the most points see the final card and vote.

If a majority of the mediums have identified the proper suspect, with ties being broken by the vote of the most clairvoyant medium, then the killer has been identified and the ghost can now rest peacefully. If not, well, perhaps you can try again...","Deduction, Murder/Mystery, Party Game",2015,7.53836,7.34656,181304,2,7,42,42,8+
http://cf.geekdo-images.com/images/pic1809823.jpg,One Night Ultimate Werewolf,"No moderator, no elimination, ten-minute games.

One Night Ultimate Werewolf is a fast game for 3-10 players in which everyone gets a role: One of the dastardly Werewolves, the tricky Troublemaker, the helpful Seer, or one of a dozen different characters, each with a special ability. In the course of a single morning, your village will decide who is a werewolf...because all it takes is lynching one werewolf to win!

Because One Night Ultimate Werewolf is so fast, fun, and engaging, youll want to play it again and again, and no two games are ever the same.

This game can be combined with One Night Ultimate Werewolf Daybreak.","Bluffing, Card Game, Deduction, Horror, Party Game",2014,7.37116,7.18724,147949,3,10,10,10,10+
http://cf.geekdo-images.com/images/pic1534148.jpg,Pandemic,"In Pandemic, several virulent diseases have broken out simultaneously all over the world! The players are disease-fighting specialists whose mission is to treat disease hotspots while researching cures for each of four plagues before they get out of hand.

The game board depicts several major population centers on Earth. On each turn, a player can use up to four actions to travel between cities, treat infected populaces, discover a cure, or build a research station. A deck of cards provides the players with these abilities, but sprinkled throughout this deck are Epidemic! cards that accelerate and intensify the diseases activity. A second, separate deck of cards controls the ""normal"" spread of the infections.

Taking a unique role within the team, players must plan their strategy to mesh with their specialists strengths in order to conquer the diseases. For example, the Operations Expert can build research stations which are needed to find cures for the diseases and which allow for greater mobility between cities; the Scientist needs only four cards of a particular disease to cure it instead of the normal five, but the diseases are spreading quickly and time is running out. If one or more diseases spreads beyond recovery or if too much time elapses, the players all lose. If they cure the four diseases, they all win!",Medical,2008,7.67237,7.58642,30549,2,4,45,45,10+
http://cf.geekdo-images.com/images/pic2576459.jpg,The Resistance,"The Empire must fall. Our mission must succeed. By destroying their key bases, we will shatter Imperial strength and liberate our people. Yet spies have infiltrated our ranks, ready for sabotage. We must unmask them. In five nights we reshape destiny or die trying. We are the Resistance!

The Resistance is a party game of social deduction. It is designed for five to ten players, lasts about 30 minutes, and has no player elimination. The Resistance is inspired by Mafia/Werewolf, yet it is unique in its core mechanics, which increase the resources for informed decisions, intensify player interaction, and eliminate player elimination.

Players are either Resistance Operatives or Imperial Spies. For three to five rounds, they must depend on each other to carry out missions against the Empire. At the same time, they must try to deduce the other players identities and gain their trust. Each round begins with discussion. When ready, the Leader entrusts sets of Plans to a certain number of players (possibly including himself/herself). Everyone votes on whether or not to approve the assignment. Once an assignment passes, the chosen players secretly decide to Support or Sabotage the mission. Based on the results, the mission succeeds (Resistance win) or fails (Empire win). When a team wins three missions, they have won the game.","Bluffing, Deduction, Negotiation, Party Game, Science Fiction, Spies/Secret Agents",2009,7.43275,7.3268,41114,5,10,30,30,12+
http://cf.geekdo-images.com/images/pic1398895.jpg,The Resistance: Avalon,"The Resistance: Avalon pits the forces of Good and Evil in a battle to control the future of civilization. Arthur represents the future of Britain, a promise of prosperity and honor, yet hidden among his brave warriors are Mordreds unscrupulous minions. These forces of evil are few in number but have knowledge of each other and remain hidden from all but one of Arthurs servants. Merlin alone knows the agents of evil, but he must speak of this only in riddles. If his true identity is discovered, all will be lost.

The Resistance: Avalon is a standalone game, and while The Resistance is not required to play, the games are compatible and can be combined.","Bluffing, Card Game, Deduction, Fantasy, Medieval, Negotiation, Party Game",2012,7.72054,7.55291,128882,5,10,30,30,12+
http://cf.geekdo-images.com/images/pic2602139.jpg,Saboteur,"Players take on the role of dwarves. As miners, they are in a mine, hunting for gold. Suddenly, a pick axe swings down and shatters the mine lamp. The saboteur has struck. But which of the players are saboteurs? Will you find the gold, or will the fiendish actions of the saboteurs lead them to it first? After three rounds, the player with the most gold is the winner.

With the help of Dwarf Cards, the players are assigned their role: either miner or saboteur. The roles are kept secret- they are only revealed at the end of the round.

The Start Card and the three Goal Cards are placed onto the table, each seven card widths apart from each other. The Goal Cards are placed face-down. The gold is on one of the Goal Cards, but nobody knows which.

Players have cards in hand. On a players turn, he must do one of three things: place a Path Card into the mine, play an Action Card in front of a player, or pass.

The Path Cards form paths leading to the Goal Cards. Path Cards must be played next to a already-played Path Card. All paths on the Path Card must match those on the already-played cards, and Path Cards may not be played sideways.

The miners are trying to build an uninterrupted path from the Start Card to a Goal Card, while the saboteurs are trying to prevent this. They shouldnt try and be too obvious about it, however, lest they be immediately discovered.

Action Cards can be placed in front of any player, including oneself. Action Cards let the players help or hinder one another, as well as obtain information about the Goal Cards.

Once a player places a Path Card that reaches the gold, the round is over. The miners have won and receive cards with gold pieces as their reward.

The round is also over if the gold could not be reached. In that case, the saboteurs have won and receive the gold pieces.

Once the Gold Cards have been distributed, the next round begins. The game is over at the end of the third round, with the player with the most gold pieces being the winner.","Bluffing, Card Game, Exploration, Party Game",2004,6.63975,6.53853,9220,3,10,30,30,8+
http://cf.geekdo-images.com/images/pic2602154.jpg,Saboteur 2 (expansion-only editions),"(Note: This listing covers only the expansion-only versions of Saboteur 2; for the Saboteur 2 listing that includes both the base game and the expansion, go to Saboteur (compilation editions).)

In Saboteur, each player takes on the role of a gold-digging dwarf or a saboteur who wants to hinder exploration of the gold mines - but each player knows only his own role, so the digging may or may not go as planned!

Each turn, a player either lays down a tunnel card to dig from the start card toward one of the goal cards (or potentially away, if a saboteur) or plays an action card to help or hinder someone. If the diggers manage to find the gold hidden under one of the goal cards, then the diggers share the loot found there; if the gold cant be reached before the deck runs out, the saboteurs profit instead. After three rounds, the player with the most gold wins.

The Saboteur 2 expansion adds new role cards (the boss, profiteers, geologists) to the base game, new action cards (steal gold, change your role), and new tunnel cards featuring doors, ladders and bridges. Whats more, the gold seekers can now be divided into teams - blue vs. green - and only those on the team that finds the gold score anything - assuming that anyone finds the gold at all, of course...","Bluffing, Card Game, Expansion for Base-game, Exploration, Party Game",2011,7.02665,6.62236,91072,2,12,45,45,8+
http://cf.geekdo-images.com/images/pic3303283.jpg,Saboteur: The Duel,"Saboteur: Duel is a standalone version of the famous card game Saboteur for one and two players. When playing alone, you want to collect as much gold as possible by digging new tunnels in the mine; when playing with an opponent, youll just want to collect more than that player, but naturally your opponent will try to block your progression by all means.

In this card game, you play path or action cards. The path cards form a maze in the direction of the six goal cards, which contain a variable number of gold stones. The action cards are used to hinder your opponent or to help you to repair broken equipment. A greedy troll also lurks in the mine, and you will have to pay him to progress and he doesnt give back any change!","Bluffing, Card Game, Exploration",2014,6.37439,5.71237,168215,1,2,30,30,8+
http://cf.geekdo-images.com/images/pic3163924.jpg,Scythe,"It is a time of unrest in 1920s Europa. The ashes from the first great war still darken the snow. The capitalistic city-state known simply as ""The Factory"", which fueled the war with heavily armored mechs, has closed its doors, drawing the attention of several nearby countries.

Scythe is an engine-building game set in an alternate-history 1920s period. It is a time of farming and war, broken hearts and rusted gears, innovation and valor. In Scythe, each player represents a character from one of five factions of Eastern Europa who are attempting to earn their fortune and claim their factions stake in the land around the mysterious Factory. Players conquer territory, enlist new recruits, reap resources, gain villagers, build structures, and activate monstrous mechs.

Each player begins the game with different resources (power, coins, combat acumen, and popularity), a different starting location, and a hidden goal. Starting positions are specially calibrated to contribute to each factions uniqueness and the asymmetrical nature of the game (each faction always starts in the same place).

Scythe gives players almost complete control over their fate. Other than each players individual hidden objective card, the only elements of luck or variability are ""encounter"" cards that players will draw as they interact with the citizens of newly explored lands. Each encounter card provides the player with several options, allowing them to mitigate the luck of the draw through their selection. Combat is also driven by choices, not luck or randomness.

Scythe uses a streamlined action-selection mechanism (no rounds or phases) to keep gameplay moving at a brisk pace and reduce downtime between turns. While there is plenty of direct conflict for players who seek it, there is no player elimination.

Every part of Scythe has an aspect of engine-building to it. Players can upgrade actions to become more efficient, build structures that improve their position on the map, enlist new recruits to enhance character abilities, activate mechs to deter opponents from invading, and expand their borders to reap greater types and quantities of resources. These engine-building aspects create a sense of momentum and progress throughout the game. The order in which players improve their engine adds to the unique feel of each game, even when playing one faction multiple times.","Civilization, Economic, Fighting, Science Fiction, Territory Building
",2016,8.34023,8.08581,169786,1,5,90,115,12+
http://cf.geekdo-images.com/images/pic428828.jpg,Small World,"In Small World, players vie for conquest and control of a world that is simply too small to accommodate them all.

Designed by Philippe Keyaerts as a fantasy follow-up to his award-winning Vinci, Small World is inhabited by a zany cast of characters such as dwarves, wizards, amazons, giants, orcs, and even humans, who use their troops to occupy territory and conquer adjacent lands in order to push the other races off the face of the earth.

Picking the right combination from the 14 different fantasy races and 20 unique special powers, players rush to expand their empires - often at the expense of weaker neighbors. Yet they must also know when to push their own over-extended civilization into decline and ride a new one to victory!

On each turn, you either use the multiple tiles of your chosen race (type of creatures) to occupy adjacent (normally) territories - possibly defeating weaker enemy races along the way, or you give up on your race letting it go ""into decline"". A race in decline is designated by flipping the tiles over to their black-and-white side.

At the end of your turn, you score one point (coin) for each territory your races occupy. You may have one active race and one race in decline on the board at the same time. Your occupation total can vary depend on the special abilities of your race and the territories they occupy. After the final round, the player with the most coins wins.","Fantasy, Fighting, Territory Building",2009,7.35935,7.27881,40692,2,5,40,80,8+
