image,objectname,description,boardgamecategories,yearpublished,average,baverage,objectid,minplayers,maxplayers,minplaytime,maxplaytime,bggrecagerange
http://cf.geekdo-images.com/images/pic1904079.jpg,Splendor,"Splendor is a game of chip-collecting and card development. Players are merchants of the Renaissance trying to buy gem mines, means of transportation, shops-all in order to acquire the most prestige points. If youre wealthy enough, you might even receive a visit from a noble at some point, which of course will further increase your prestige.

On your turn, you may (1) collect chips (gems), or (2) buy and build a card, or (3) reserve one card. If you collect chips, you take either three different kinds of chips or two chips of the same kind. If you buy a card, you pay its price in chips and add it to your playing area. To reserve a card-in order to make sure you get it, or, why not, your opponents dont get it-you place it in front of you face down for later building; this costs you a round, but you also get gold in the form of a joker chip, which you can use as any gem.

All of the cards you buy increase your wealth as they give you a permanent gem bonus for later buys; some of the cards also give you prestige points. In order to win the game, you must reach 15 prestige points before your opponents do.","Card Game, Economic, Renaissance
",2014,7.54493,7.43936,148228,2,4,30,30,8+
http://cf.geekdo-images.com/images/pic1203476.jpg,Spot it!,"Spot it!, a.k.a. Dobble, is a simple pattern recognition game in which players try to find an image shown on two cards.

Each card in Spot it! features eight different symbols, with the symbols varying in size from one card to the next. Any two cards have exactly one symbol in common. For the basic Spot it! game, reveal one card, then another. Whoever spots the symbol in common on both cards claims the first card, then another card is revealed for players to search, and so on. Whoever has collected the most cards when the 55-card deck runs out wins!

Rules for different games - each an observation game with a speed element - are included with Spot it!, with the first player to find a match either gaining or getting rid of a card. Multiple versions of Spot it! have been published, with images in each version ranging from Halloween to hockey to baseball to San Francisco.

The game is sold as Spot it! in the USA and Dobble in Europe, with slight differences between the two editions.","Card Game, ""Childrens Game"", Educational, Party Game, Real-time, Sports",2009,6.75235,6.54811,63268,2,8,15,15,4+
http://cf.geekdo-images.com/images/pic1059779.jpg,Star Fluxx,"Fluxx gets the Science Fiction treatment. From the publisher: ""Just when you thought that Fluxx had gone as far as it could go - it blasts off for the Stars! Explore the vastness of space-themed humor with your valiant Captain, Engineer, and, of course, your Expendable Crewman. Go check out that Small Moon or is it really a Space Station? You may be swayed by Unseen Forces, held hostage by Evil Computers, or find your ship infested with Cute Fuzzy Aliens.""

Like its brethren, Star Fluxx is the game of ever changing rules. It starts out as Draw 1, Play 1, but even that can change. When a Goal card is played, you can win by meeting the Goal, usually by having the correct Keeper cards in front of you. Action and Surprise cards help you to meet the Goal, or stop your opponent. Creeper cards usually prevent you from winning, but are sometimes necessary to meet the Goal.","Card Game, Science Fiction",2011,6.43081,6.14684,102104,2,6,10,10,10+
http://cf.geekdo-images.com/images/pic1365413.jpg,Star Trek: Catan,"Star Trek: Catan takes two well-known media properties and merges them into, well, into something that is 95% The Settlers of Catan glossed with Trek tropes and spiced with a Trek-themed version of a mini-expansion previously only available in German.

In Star Trek: Catan, players start the game with two small Outposts at the intersection of three planets, with each planet supplying resources based on the result of a dice roll. Players collect and trade these resources (dilithium, tritanium, food, oxygen and water) in order to build Starships that connect regions in the galaxy, establish more Outposts and Starbases (upgraded Outposts) at new intersection points in order to increase resource acquisition, and acquire Development Cards that provide Victory Points (VPs) or special abilities.

On a dice roll of 7, a Klingon ship swoops in to prevent resource production on one planet while taxing spacegoers who hold too many resources.

Star Trek: Catan differs from the basic Settlers in one aspect: a set of Support Cards formerly available only in German as Catan Scenarios: Helpers of Catan. Each Support Card features a special ability and one of Kirk, Spock, McCoy, Sulu, Scott, Uhura, Chekov, Chapel, Rand, or Sarek. Some special abilities make basic actions better, such as reducing the costs of Starbase upgrades or allowing the player to trade a resource of their choice at 2:1 for a turn, while others break rules, such as protecting the player from discarding on a 7 or producing a resource when the player rolls a number that wouldnt otherwise produce for them. Players get a specific Support Card during setup based on turn order, with later players getting generally more useful abilities to compensate for early player advantage. When a player uses a Support Card ability for the first time, they may trade it in for a Support Card of their choice or keep it for a second use, but they may only trade immediately after use.","Movies / TV / Radio theme, Negotiation, Science Fiction",2012,7.08242,6.57208,117985,3,4,75,75,8+
http://cf.geekdo-images.com/images/pic2402894.png,Sylvion,"The mad Fire Elemental lord is out to burn down the dream forest. Attacking in waves using Fire Elementals, your only defense are trees and fountains and those animals brave enough to offer aid before scurrying away to safety. Using a unique drafting system and combining it with a tower defense game, will you be able to keep your forest green?

Sylvion is a tower-defense type game in which attacks come down four rows and in waves. You build a deck using a unique drafting process and play cards from your hand by paying with other cards in your hand. You can play cards to the rows like fountains and trees or play animals for instant effects or to manipulate the enemy decks of cards. When all the waves have finished, you must have kept the heart of the Sylvion verdant, or else the whole forest of the Oniverse will be destroyed.

This game can be played in an introductory style, advanced mode, and includes two expansions and an appendix for further challenges and complexity.","Animals, Card Game, Environmental, Fantasy",2015,7.30315,6.5462,143405,1,2,30,30,10+
http://cf.geekdo-images.com/images/pic2523100.jpg,Telestrations,"""Each player begins by sketching a TELESTRATIONS word dictated by the roll of a die. The old fashioned sand timer may limit the amount of time they get to execute their sketch, but it certainly doesnt limit creativity! Times up! All players, all at the same time, pass their sketch to the next player, who must guess whats been drawn. Players then simultaneously pass their guess -- which hopefully matches the original word (or does it??) -- to the next player who must try to draw the word they see -- and so on.""

""Telestrations contains eight erasable sketchbooks and markers, a die, a 90 second sand-timer and 2,400 words to choose from.""","Humor, Party Game, Real-time",2009,7.4405,7.19262,46213,4,8,30,30,8+
http://cf.geekdo-images.com/images/pic66668.jpg,Ticket to Ride: Europe,"Ticket to Ride: Europe takes you on a new train adventure across Europe. From Edinburgh to Constantinople and from Lisbon to Moscow, youll visit great cities of turn-of-the-century Europe. Like the original Ticket to Ride, the game remains elegantly simple, can be learned in 5 minutes, and appeals to both families and experienced gamers. Ticket to Ride: Europe is a complete, new game and does not require the original version.

More than just a new map, Ticket to Ride: Europe features brand new gameplay elements. Tunnels may require you to pay extra cards to build on them, Ferries require locomotive cards in order to claim them, and Stations allow you to sacrifice a few points in order to use an opponents route to connect yours. The game also includes larger format cards and Train Station game pieces.

The overall goal remains the same: collect and play train cards in order to place your pieces on the board, attempting to connect cities on your ticket cards. Points are earned both from placing trains and completing tickets but uncompleted tickets lose you points. The player who has the most points at the end of the game wins.","Trains, Travel",2005,7.59163,7.48146,14996,2,5,30,60,8+
http://cf.geekdo-images.com/images/pic1293719.jpg,Tokaido,"In Tokaido, each player is a traveler crossing the ""East sea road"", one of the most magnificent roads of Japan. While traveling, you will meet people, taste fine meals, collect beautiful items, discover great panoramas, and visit temples and wild places but at the end of the day, when everyone has arrived at the end of the road youll have to be the most initiated traveler, which means that youll have to be the one who discovered the most interesting and varied things.

The potential action spaces in Tokaido are laid out on a linear track, with players advancing down this track to take actions.  The player who is currently last on the track takes a turn by advancing forward on the track to their desired action and taking that action.  So, players must choose whether to advance slowly in order to get more turns, or to travel more rapidly to beat other players to their desired action spaces.

The action spaces allow a variety of actions that will score in different, but roughly equal, ways.  Some action spaces allow players to collect money, while others offer players a way to spend that money to acquire points.  Other action spaces allow players to engage in various set collections that score points for assembling those sets.  Some action spaces simply award players points for stopping on them, or give the player a randomly determined action from all of the other types.

All of the actions in Tokaido are very simple, and combined with a unique graphic design, Tokaido offers players a peaceful zen mood in its play.",Travel,2012,7.08263,6.9088,123540,2,5,45,45,8+
http://cf.geekdo-images.com/images/pic3477808.jpg,Watson & Holmes,"Watson & Holmes is a game of deduction set within the magnificent works of Arthur Conan Doyle. Two to seven aspiring detectives step into the shoes of Doctor Watson, working alongside the detective Sherlock Holmes to try to solve a series of so far unpublished cases directly extracted from Doctor John H. Watsons diaries. Those who accept the challenge relive the adventures of the crime-solving duo, visiting each of the locations where the inquiries were made. Following the trail, each clue brings players closer to solving the case.

The objective of the game is to immerse yourself in the Victorian world depicted in each story. Visit the right places, decipher the clues, and above all find the path that leads you to solve the mystery before anybody else. Victory goes to the player who accurately uses the deductive reasoning so famously and ingeniously implemented by the hero of 221B Baker Street.

The game consists of a series of separate cases, each of which raises a number of questions that each player tries to solve before anyone else. To do this, once the case and the questions have been read aloud, players proceed to visit the locations where the clues are located. Each location cannot be accessed by more than one player at any one time, so if two or more players want to go to the same place, the player who travels there the fastest (i.e., he who uses the largest number of Carriage Tokens) gets the clue, forcing the others to go to a different location. Once every player has a destination, they proceed to read in secret the clue that was discovered at that location. They can discreetly take any notes they deem appropriate. Once this is done, the cards are returned to their place so that others can read them in later turns.

This procedure is repeated during each turn until one player believes he has found the solutions to the case; at that time, he must go to 221B Baker Street to check if his answers are correct. If all the answers are correct, the player wins; if they are wrong, he will have lost and retires from the game, and the game continues.

Each detective will also have the invaluable assistance of a number of Sherlock Holmes allies, above all, the good Dr Watson and of course of the detective himself.","Deduction, Murder/Mystery, Novel-based",2015,7.50839,6.20616,182694,2,7,45,75,12+
http://cf.geekdo-images.com/images/pic2664015.jpg,Zombie Dice,"Eat brains. Dont get shotgunned.

In Zombie Dice, you are a zombie. You want braaains and more brains than any of your zombie buddies. The 13 custom dice are your victims. Push your luck to eat their brains, but stop rolling before the shotgun blasts end your turn! Whoever collects 13 brains first wins. Each game takes 10 to 20 minutes and can be taught in a single round.

Each turn, you take three dice from the box and roll them. A brain symbol is worth one point at the end of the round, while footsteps allow you to reroll this particular dice. Shotgun blasts on the other hand are rather bad, cause if you collect three shotgun blasts during your turn, it is over for you and you get no points. After rolling three dice, you may decide if you want to score your current brain collection or if you want to push your luck by grabbing new dice so you have three again and roll once more.","Dice, Horror, Humor, Party Game, Zombies",2010,6.2387,6.12443,62871,2,99,10,20,6+